{"arch":"AMD64","artifact_cache":"C:\\Users\\iStar\\Documents\\ChatGPT\\illm\\.illm\\cache\\runtime","bootstrap_digest":"1a090333ad37390fbd9dce5691d0176996eec8b53b61a5b3b116d6ce34fdfdd9","entrypoints":{"illm":"C:\\Users\\iStar\\Documents\\ChatGPT\\illm\\.illm\\envs\\v01-release-cpu-r3\\Scripts\\illm.exe"},"environment_id":"fbcc988c-ccdc-4663-b007-738703e86d39","environment_root":"C:\\Users\\iStar\\Documents\\ChatGPT\\illm\\.illm\\envs\\v01-release-cpu-r3","finalized":true,"installed_packages":{"certifi":"2026.10.19","charset-normalizer":"3.5.2","colorama":"0.4.6","filelock":"4.2.4","fsspec":"2026.9.0","huggingface-hub":"0.36.0","idna":"3.20","illm":"0.1.0","iniconfig":"2.3.0","jinja2":"3.1.6","markupsafe":"3.0.4","mpmath":"1.3.0","mypy":"1.18.2","mypy-extensions":"1.1.0","networkx":"3.7","numpy":"2.3.4","packaging":"26.3","pathspec":"1.1.1","pip":"26.2.1","pluggy":"1.6.0","pygments":"2.21.0","pytest":"9.1.1","pyyaml":"6.0.3","regex":"2026.9.29","requests":"2.34.2","safetensors":"0.6.2","setuptools":"83.0.0","sympy":"1.14.0","tokenizers":"0.22.1","torch":"2.8.0+cpu","tqdm":"4.70.1","transformers":"4.57.1","typing-extensions":"4.16.0","urllib3":"2.8.0","wheel":"0.47.0"},"lock_digest":"9c622ec4ba84d0c7a2b019a54352de08de8df169f0ced8dac3734acb4000142c","manifest_digest":"e5be47a2d55316989b26c399bcb660e29b074707a7162614e3b2056506ba69da","os":"Windows","profile":"v01-release-cpu-r3","project_root":"C:\\Users\\iStar\\Documents\\ChatGPT\\illm","project_root_digest":"3b0de700bfa4e7e43e9aaed9765dc1ad1274d1f0c33f86015105d00629488c09","python_executable":"C:\\Users\\iStar\\Documents\\ChatGPT\\illm\\.illm\\envs\\v01-release-cpu-r3\\Scripts\\python.exe","python_version":"3.12.14","runtime_artifacts":[{"filename":"certifi-2026.10.19-py3-none-any.whl","name":"certifi","sha256":"42d35340cc5b9ba78e818ddbff0c5b1c2b779de448a340fd1b989f5fa8670e1b","size_bytes":136464,"version":"2026.10.19"},{"filename":"charset_normalizer-3.5.2-cp312-cp312-win_amd64.whl","name":"charset-normalizer","sha256":"780fbe7cab297b81dad9fb8dc5eb003c0468ffb0d9e5f65068c53a34661a96bc","size_bytes":207486,"version":"3.5.2"},{"filename":"colorama-0.4.6-py2.py3-none-any.whl","name":"colorama","sha256":"4f1d9991f5acc0ca119f9d443620b77f9d6b33703e51011c16baf57afb285fc6","size_bytes":25335,"version":"0.4.6"},{"filename":"filelock-4.2.4-py3-none-any.whl","name":"filelock","sha256":"301241438c57936ef93f4243a94f2559022268bfcf9b375a9a72eb0f8db8358e","size_bytes":162475,"version":"4.2.4"},{"filename":"fsspec-2026.9.0-py3-none-any.whl","name":"fsspec","sha256":"8dd6e646e99ea382bd85f97a45e6b526a442d79423a7dc673f1e2756d05fcb5f","size_bytes":221738,"version":"2026.9.0"},{"filename":"huggingface_hub-0.36.0-py3-none-any.whl","name":"huggingface-hub","sha256":"7bcc9ad17d5b3f07b57c78e79d527102d08313caa278a641993acddcb894548d","size_bytes":566094,"version":"0.36.0"},{"filename":"idna-3.20-py3-none-any.whl","name":"idna","sha256":"ab7ae7122974553370f0bdb919e1a960b2cd1bc1ef0276416d896db81c14582c","size_bytes":69583,"version":"3.20"},{"filename":"jinja2-3.1.6-py3-none-any.whl","name":"jinja2","sha256":"85ece4451f492d0c13c5dd7c13a64681a86afae63a5f347908daf103ce6d2f67","size_bytes":134899,"version":"3.1.6"},{"filename":"markupsafe-3.0.4-cp312-cp312-win_amd64.whl","name":"markupsafe","sha256":"11935df9bf455ed0c04eb87bcd720f02b1fe5e02128a9430f23aed6f93336fc7","size_bytes":14303,"version":"3.0.4"},{"filename":"mpmath-1.3.0-py3-none-any.whl","name":"mpmath","sha256":"a0b2b9fe80bbcd81a6647ff13108738cfb482d481d826cc0e02f5b35e5c88d2c","size_bytes":536198,"version":"1.3.0"},{"filename":"networkx-3.7-py3-none-any.whl","name":"networkx","sha256":"e3fd2c13a7814cee3746340d8d7f8598a67f16a58bf47fb7f8793fab6efca1b0","size_bytes":2142205,"version":"3.7"},{"filename":"numpy-2.3.4-cp312-cp312-win_amd64.whl","name":"numpy","sha256":"985f1e46358f06c2a09921e8921e2c98168ed4ae12ccd6e5e87a4f1857923f32","size_bytes":12787999,"version":"2.3.4"},{"filename":"packaging-26.3-py3-none-any.whl","name":"packaging","sha256":"d7193f7c8e4e93f444fde0262bf90af30e16fa0ad0ad44cb553c87339b23cd1c","size_bytes":129956,"version":"26.3"},{"filename":"pyyaml-6.0.3-cp312-cp312-win_amd64.whl","name":"pyyaml","sha256":"5fcd34e47f6e0b794d17de1b4ff496c00986e1c83f7ab2fb8fcfe9616ff7477b","size_bytes":154003,"version":"6.0.3"},{"filename":"regex-2026.9.29-cp312-cp312-win_amd64.whl","name":"regex","sha256":"fdd88ed5e20b1bcdd234421e454962c971aa44b653bdb7f1ea9ef683e90fb649","size_bytes":280334,"version":"2026.9.29"},{"filename":"requests-2.34.2-py3-none-any.whl","name":"requests","sha256":"2a0d60c172f83ac6ab31e4554906c0f3b3588d37b5cb939b1c061f4907e278e0","size_bytes":73075,"version":"2.34.2"},{"filename":"safetensors-0.6.2-cp38-abi3-win_amd64.whl","name":"safetensors","sha256":"c7b214870df923cbc1593c3faee16bec59ea462758699bd3fee399d00aac072c","size_bytes":320192,"version":"0.6.2"},{"filename":"setuptools-83.0.0-py3-none-any.whl","name":"setuptools","sha256":"29b23c360f22f414dc7336bb39178cc7bcbf6021ed2733cde173f09dba19abb3","size_bytes":1008090,"version":"83.0.0"},{"filename":"sympy-1.14.0-py3-none-any.whl","name":"sympy","sha256":"e091cc3e99d2141a0ba2847328f5479b05d94a6635cb96148ccb3f34671bd8f5","size_bytes":6299353,"version":"1.14.0"},{"filename":"tokenizers-0.22.1-cp39-abi3-win_amd64.whl","name":"tokenizers","sha256":"65fd6e3fb11ca1e78a6a93602490f134d1fdeb13bcef99389d5102ea318ed138","size_bytes":2674684,"version":"0.22.1"},{"filename":"torch-2.8.0+cpu-cp312-cp312-win_amd64.whl","name":"torch","sha256":"2be20b2c05a0cce10430cc25f32b689259640d273232b2de357c35729132256d","size_bytes":619352539,"version":"2.8.0+cpu"},{"filename":"tqdm-4.70.1-py3-none-any.whl","name":"tqdm","sha256":"c293e525e6fef9c20e8728fd4612df02a0aa31bb5fe91ecd93e123b1b7bffa73","size_bytes":80199,"version":"4.70.1"},{"filename":"transformers-4.57.1-py3-none-any.whl","name":"transformers","sha256":"b10d05da8fa67dc41644dbbf9bc45a44cb86ae33da6f9295f5fbf5b7890bd267","size_bytes":11990925,"version":"4.57.1"},{"filename":"typing_extensions-4.16.0-py3-none-any.whl","name":"typing-extensions","sha256":"481caa481374e813c1b176ada14e97f1f67a4539ce9cfeb3f350d78d6370c2e8","size_bytes":45571,"version":"4.16.0"},{"filename":"urllib3-2.8.0-py3-none-any.whl","name":"urllib3","sha256":"0cf3cae568d36aa9576b28dfb35f11328f1cb974ca7647d9475ebb86c75ac6e3","size_bytes":135717,"version":"2.8.0"}],"runtime_lock_digest":"5149ad41ff2e0f261fbec8fe11dcefe2bed90ab8431b1c5339b8e08b59320a34","runtime_probe":{"compiled_arches":[],"cuda_build":null,"device":"cpu","device_capability":null,"gpu_name":null,"safetensors":"0.6.2","smoke_sum":3.0,"tokenizers":"0.22.1","torch":"2.8.0+cpu","transformers":"4.57.1"},"runtime_profile_id":"py312-win-amd64-cpu","schema_version":1}
