{"arch":"x86_64","artifact_cache":"/mnt/c/Users/iStar/Documents/ChatGPT/illm/.illm/cache/runtime","bootstrap_digest":"1a090333ad37390fbd9dce5691d0176996eec8b53b61a5b3b116d6ce34fdfdd9","entrypoints":{"illm":"/home/istar/illm-v01-r3-clean-26YfFo/.illm/envs/v01-release-clean-r3/bin/illm"},"environment_id":"0a356da2-a21a-428d-89f6-746bc05a640d","environment_root":"/home/istar/illm-v01-r3-clean-26YfFo/.illm/envs/v01-release-clean-r3","finalized":true,"installed_packages":{"certifi":"2026.10.19","charset-normalizer":"3.5.2","colorama":"0.4.6","filelock":"4.2.4","fsspec":"2026.9.0","hf-xet":"1.7.0","huggingface-hub":"0.36.0","idna":"3.20","illm":"0.1.0","iniconfig":"2.3.0","jinja2":"3.1.6","markupsafe":"3.0.4","mpmath":"1.3.0","mypy":"1.18.2","mypy-extensions":"1.1.0","networkx":"3.7","numpy":"2.3.4","packaging":"26.3","pathspec":"1.1.1","pip":"26.2.1","pluggy":"1.6.0","pygments":"2.21.0","pytest":"9.1.1","pyyaml":"6.0.3","regex":"2026.9.29","requests":"2.34.2","safetensors":"0.6.2","setuptools":"83.0.0","sympy":"1.14.0","tokenizers":"0.22.1","torch":"2.8.0+cpu","tqdm":"4.70.1","transformers":"4.57.1","typing-extensions":"4.16.0","urllib3":"2.8.0","wheel":"0.47.0"},"lock_digest":"db3d4be5a95bda8364c9333a3072157dd97ddaf0c83c0acdc2c800c21ceb4219","manifest_digest":"0fce07003c2f7d12420fcaac543ce4970ba968e0ae4509f94cb46dc9161e497d","os":"Linux","profile":"v01-release-clean-r3","project_root":"/home/istar/illm-v01-r3-clean-26YfFo","project_root_digest":"3b0de700bfa4e7e43e9aaed9765dc1ad1274d1f0c33f86015105d00629488c09","python_executable":"/home/istar/illm-v01-r3-clean-26YfFo/.illm/envs/v01-release-clean-r3/bin/python","python_version":"3.12.3","runtime_artifacts":[{"filename":"certifi-2026.10.19-py3-none-any.whl","name":"certifi","sha256":"42d35340cc5b9ba78e818ddbff0c5b1c2b779de448a340fd1b989f5fa8670e1b","size_bytes":136464,"version":"2026.10.19"},{"filename":"charset_normalizer-3.5.2-cp312-cp312-manylinux2014_x86_64.manylinux_2_17_x86_64.manylinux_2_28_x86_64.whl","name":"charset-normalizer","sha256":"3d31298449090ab8d47b7b1b2a555ff73cac7ed438a08b7ac160980c7ebed649","size_bytes":257601,"version":"3.5.2"},{"filename":"filelock-4.2.4-py3-none-any.whl","name":"filelock","sha256":"301241438c57936ef93f4243a94f2559022268bfcf9b375a9a72eb0f8db8358e","size_bytes":162475,"version":"4.2.4"},{"filename":"fsspec-2026.9.0-py3-none-any.whl","name":"fsspec","sha256":"8dd6e646e99ea382bd85f97a45e6b526a442d79423a7dc673f1e2756d05fcb5f","size_bytes":221738,"version":"2026.9.0"},{"filename":"hf_xet-1.7.0-cp38-abi3-manylinux2014_x86_64.manylinux_2_17_x86_64.whl","name":"hf-xet","sha256":"2814a6e999d13464c4d679b788cc5d784eb5a4edfc638a31f10e9a11ab531ef8","size_bytes":4212180,"version":"1.7.0"},{"filename":"huggingface_hub-0.36.0-py3-none-any.whl","name":"huggingface-hub","sha256":"7bcc9ad17d5b3f07b57c78e79d527102d08313caa278a641993acddcb894548d","size_bytes":566094,"version":"0.36.0"},{"filename":"idna-3.20-py3-none-any.whl","name":"idna","sha256":"ab7ae7122974553370f0bdb919e1a960b2cd1bc1ef0276416d896db81c14582c","size_bytes":69583,"version":"3.20"},{"filename":"jinja2-3.1.6-py3-none-any.whl","name":"jinja2","sha256":"85ece4451f492d0c13c5dd7c13a64681a86afae63a5f347908daf103ce6d2f67","size_bytes":134899,"version":"3.1.6"},{"filename":"markupsafe-3.0.4-cp312-cp312-manylinux2014_x86_64.manylinux_2_17_x86_64.manylinux_2_28_x86_64.whl","name":"markupsafe","sha256":"8e124f974786f831d6043728e38296969d3579db8896fe004682f5758e613581","size_bytes":22985,"version":"3.0.4"},{"filename":"mpmath-1.3.0-py3-none-any.whl","name":"mpmath","sha256":"a0b2b9fe80bbcd81a6647ff13108738cfb482d481d826cc0e02f5b35e5c88d2c","size_bytes":536198,"version":"1.3.0"},{"filename":"networkx-3.7-py3-none-any.whl","name":"networkx","sha256":"e3fd2c13a7814cee3746340d8d7f8598a67f16a58bf47fb7f8793fab6efca1b0","size_bytes":2142205,"version":"3.7"},{"filename":"numpy-2.3.4-cp312-cp312-manylinux_2_27_x86_64.manylinux_2_28_x86_64.whl","name":"numpy","sha256":"4121c5beb58a7f9e6dfdee612cb24f4df5cd4db6e8261d7f4d7450a997a65d6a","size_bytes":16641271,"version":"2.3.4"},{"filename":"packaging-26.3-py3-none-any.whl","name":"packaging","sha256":"d7193f7c8e4e93f444fde0262bf90af30e16fa0ad0ad44cb553c87339b23cd1c","size_bytes":129956,"version":"26.3"},{"filename":"pyyaml-6.0.3-cp312-cp312-manylinux2014_x86_64.manylinux_2_17_x86_64.manylinux_2_28_x86_64.whl","name":"pyyaml","sha256":"ba1cc08a7ccde2d2ec775841541641e4548226580ab850948cbfda66a1befcdc","size_bytes":807870,"version":"6.0.3"},{"filename":"regex-2026.9.29-cp312-cp312-manylinux2014_x86_64.manylinux_2_17_x86_64.manylinux_2_28_x86_64.whl","name":"regex","sha256":"39ab5894d971f9ac68baa6eca5c50387db579cfcacf36ae8df3feceb1815e6d0","size_bytes":807783,"version":"2026.9.29"},{"filename":"requests-2.34.2-py3-none-any.whl","name":"requests","sha256":"2a0d60c172f83ac6ab31e4554906c0f3b3588d37b5cb939b1c061f4907e278e0","size_bytes":73075,"version":"2.34.2"},{"filename":"safetensors-0.6.2-cp38-abi3-manylinux_2_17_x86_64.manylinux2014_x86_64.whl","name":"safetensors","sha256":"8045db2c872db8f4cbe3faa0495932d89c38c899c603f21e9b6486951a5ecb8f","size_bytes":485835,"version":"0.6.2"},{"filename":"setuptools-83.0.0-py3-none-any.whl","name":"setuptools","sha256":"29b23c360f22f414dc7336bb39178cc7bcbf6021ed2733cde173f09dba19abb3","size_bytes":1008090,"version":"83.0.0"},{"filename":"sympy-1.14.0-py3-none-any.whl","name":"sympy","sha256":"e091cc3e99d2141a0ba2847328f5479b05d94a6635cb96148ccb3f34671bd8f5","size_bytes":6299353,"version":"1.14.0"},{"filename":"tokenizers-0.22.1-cp39-abi3-manylinux_2_17_x86_64.manylinux2014_x86_64.whl","name":"tokenizers","sha256":"e2ef6063d7a84994129732b47e7915e8710f27f99f3a3260b8a38fc7ccd083f4","size_bytes":3250221,"version":"0.22.1"},{"filename":"torch-2.8.0+cpu-cp312-cp312-manylinux_2_28_x86_64.whl","name":"torch","sha256":"cb9a8ba8137ab24e36bf1742cb79a1294bd374db570f09fc15a5e1318160db4e","size_bytes":183914597,"version":"2.8.0+cpu"},{"filename":"tqdm-4.70.1-py3-none-any.whl","name":"tqdm","sha256":"c293e525e6fef9c20e8728fd4612df02a0aa31bb5fe91ecd93e123b1b7bffa73","size_bytes":80199,"version":"4.70.1"},{"filename":"transformers-4.57.1-py3-none-any.whl","name":"transformers","sha256":"b10d05da8fa67dc41644dbbf9bc45a44cb86ae33da6f9295f5fbf5b7890bd267","size_bytes":11990925,"version":"4.57.1"},{"filename":"typing_extensions-4.16.0-py3-none-any.whl","name":"typing-extensions","sha256":"481caa481374e813c1b176ada14e97f1f67a4539ce9cfeb3f350d78d6370c2e8","size_bytes":45571,"version":"4.16.0"},{"filename":"urllib3-2.8.0-py3-none-any.whl","name":"urllib3","sha256":"0cf3cae568d36aa9576b28dfb35f11328f1cb974ca7647d9475ebb86c75ac6e3","size_bytes":135717,"version":"2.8.0"}],"runtime_lock_digest":"e0e40645e6e54f053b08587c030331f665e5cf648143f846b284960e09f4d799","runtime_probe":{"compiled_arches":[],"cuda_build":null,"device":"cpu","device_capability":null,"gpu_name":null,"safetensors":"0.6.2","smoke_sum":3.0,"tokenizers":"0.22.1","torch":"2.8.0+cpu","transformers":"4.57.1"},"runtime_profile_id":"py312-linux-x86_64-cpu","schema_version":1}
